<!--
This file is protected by Copyright. Please refer to the COPYRIGHT file 
distributed with this source distribution.

This file is part of REDHAWK core.

REDHAWK core is free software: you can redistribute it and/or modify it under 
the terms of the GNU Lesser General Public License as published by the Free 
Software Foundation, either version 3 of the License, or (at your option) any 
later version.

REDHAWK core is distributed in the hope that it will be useful, but WITHOUT ANY 
WARRANTY; without even the implied warranty of MERCHANTABILITY or FITNESS FOR 
A PARTICULAR PURPOSE.  See the GNU Lesser General Public License for more 
details.

You should have received a copy of the GNU Lesser General Public License along 
with this program.  If not, see http://www.gnu.org/licenses/.
-->

<!ELEMENT softwareassembly
	( description?
	, componentfiles
	, partitioning
	, assemblycontroller
	, connections?
	, externalports?
	, externalproperties?
	, options?
	, usesdevicedependencies?
	)>
<!ATTLIST softwareassembly
	id		ID	#REQUIRED
	name		CDATA	#IMPLIED
	version		CDATA	#IMPLIED>

<!ELEMENT description (#PCDATA)>

<!ELEMENT componentfiles 
	( componentfile+
	)>

<!ELEMENT componentfile
	( localfile 
	)>
<!ATTLIST componentfile
	id		ID	#REQUIRED
	type		CDATA	#IMPLIED>

<!ELEMENT localfile EMPTY>
<!ATTLIST localfile
	name		CDATA	#REQUIRED>

<!ELEMENT partitioning 
	( componentplacement
	|  hostcollocation
	)*>

<!ELEMENT componentplacement 
	( componentfileref
	, componentinstantiation+
	)>

<!ELEMENT componentfileref  EMPTY>
<!ATTLIST componentfileref
	refid		CDATA	#REQUIRED>

<!ELEMENT componentinstantiation
	( usagename?
	, componentproperties?
        , affinity?
        , loggingconfig?
	, findcomponent?
	, devicerequires?
	)>
<!ATTLIST componentinstantiation
	id		ID 	#REQUIRED
	startorder	CDATA	#IMPLIED>

<!ELEMENT usagename (#PCDATA)>

<!ELEMENT loggingconfig (#PCDATA)>
<!ATTLIST loggingconfig 
          level CDATA #IMPLIED >

<!ELEMENT affinity
	( simpleref
	| simplesequenceref
	| structref
	| structsequenceref
	)+ >

<!ELEMENT devicerequires
	( requires
	)+ >

<!ELEMENT componentproperties 
	( simpleref
	| simplesequenceref
	| structref
	| structsequenceref
	)+ >

<!ELEMENT findcomponent
	( componentresourcefactoryref
	| namingservice
	)>

<!ELEMENT componentresourcefactoryref
	( resourcefactoryproperties?
	)>
<!ATTLIST componentresourcefactoryref 
	refid		CDATA	#REQUIRED>

<!ELEMENT devicethatloadedthiscomponentref EMPTY>
<!ATTLIST devicethatloadedthiscomponentref 
	refid		CDATA	#REQUIRED>

<!ELEMENT deviceusedbythiscomponentref EMPTY>
<!ATTLIST deviceusedbythiscomponentref 
	refid		CDATA	#REQUIRED
	usesrefid	CDATA	#REQUIRED>

<!ELEMENT deviceusedbyapplication EMPTY>
<!ATTLIST deviceusedbyapplication
	usesrefid	CDATA	#REQUIRED>

<!ELEMENT resourcefactoryproperties 
	( simpleref
	| simplesequenceref
	| structref
	| structsequenceref
	)+ >

<!ELEMENT requires EMPTY>
<!ATTLIST requires
	id		CDATA	#REQUIRED
	value		CDATA	#REQUIRED>

<!ELEMENT simpleref EMPTY>
<!ATTLIST simpleref
	refid		CDATA	#REQUIRED
	value		CDATA	#REQUIRED>
		
<!ELEMENT simplesequenceref
	(values
	)>
<!ATTLIST simplesequenceref
	refid		CDATA	#REQUIRED>

<!ELEMENT structref
	( (simpleref | simplesequenceref)+       
	)>
<!ATTLIST structref
	refid		CDATA	#REQUIRED>

<!ELEMENT structsequenceref
	( structvalue+
	)>
<!ATTLIST structsequenceref
	refid		CDATA	#REQUIRED>

<!ELEMENT structvalue
	( (simpleref | simplesequenceref)+
	)>
		
<!ELEMENT values
	( value+ 
	)>
		
<!ELEMENT value (#PCDATA)>

<!ELEMENT componentinstantiationref EMPTY>
<!ATTLIST componentinstantiationref 
	refid		CDATA	#REQUIRED>

<!ELEMENT findby
	( namingservice
	| stringifiedobjectref
	| domainfinder
	)>

<!ELEMENT namingservice EMPTY>
<!ATTLIST namingservice
	name 		CDATA	#REQUIRED>

<!ELEMENT stringifiedobjectref (#PCDATA)>

<!ELEMENT domainfinder EMPTY>
<!ATTLIST domainfinder
	type		CDATA	#REQUIRED
	name		CDATA	#IMPLIED>

<!ELEMENT hostcollocation
	( componentplacement+
        , usesdeviceref*
        , reservation*
	)>

<!ATTLIST hostcollocation
	id		ID	#IMPLIED
	name		CDATA	#IMPLIED>

<!ELEMENT usesdeviceref EMPTY>
<!ATTLIST usesdeviceref
	refid		CDATA	#REQUIRED>

<!ELEMENT reservation EMPTY>
<!ATTLIST reservation
    kind        CDATA   #REQUIRED
    value       CDATA   #REQUIRED>

<!ELEMENT assemblycontroller
	( componentinstantiationref
	)>

<!ELEMENT connections
	( connectinterface*
	)>

<!ELEMENT connectinterface
	( usesport
	, ( providesport
	  | componentsupportedinterface
	  | findby
	  )
	)>
<!ATTLIST connectinterface
	id 		ID	#IMPLIED>

<!ELEMENT usesport
	( usesidentifier
	, (componentinstantiationref
	   | devicethatloadedthiscomponentref
	   | deviceusedbythiscomponentref
	   | deviceusedbyapplication
	   | findby
	   )
	)>

<!ELEMENT usesidentifier (#PCDATA)>

<!ELEMENT providesport
	( providesidentifier
	, ( componentinstantiationref
	  | devicethatloadedthiscomponentref
	  | deviceusedbythiscomponentref
	  | deviceusedbyapplication
	  | findby 
        )
	)>

<!ELEMENT providesidentifier (#PCDATA)>

<!ELEMENT componentsupportedinterface
	( supportedidentifier
	, ( componentinstantiationref
	  | devicethatloadedthiscomponentref
	  | deviceusedbythiscomponentref
	  | deviceusedbyapplication
	  | findby
	  )
	)>

<!ELEMENT supportedidentifier (#PCDATA)>

<!ELEMENT externalports 
	(port+
	)>

<!ELEMENT port
	( description?
	, (usesidentifier | providesidentifier | supportedidentifier)
	, componentinstantiationref
	)>
<!ATTLIST port
	externalname 		CDATA	#IMPLIED>

<!ELEMENT externalproperties
	(property+
	)>

<!ELEMENT property EMPTY>
<!ATTLIST property
	comprefid			CDATA	#REQUIRED
	propid				CDATA	#REQUIRED
	externalpropid		CDATA	#IMPLIED>

<!ELEMENT options
    (option+
    )>
<!ATTLIST option
    name                CDATA   #REQUIRED
    value               CDATA   #REQUIRED>

<!ELEMENT usesdevicedependencies
	(usesdevice+
	)>

<!ELEMENT usesdevice
	( propertyref
	  | simpleref
	  | simplesequenceref
	  | structref
	  | structsequenceref
	)+ >
<!ATTLIST usesdevice
	id			CDATA	#REQUIRED
	type		CDATA	#IMPLIED>

<!ELEMENT propertyref EMPTY>
<!ATTLIST propertyref
	refid		CDATA	#REQUIRED
	value		CDATA	#REQUIRED>
