<?xml version="1.0" encoding="UTF-8"?>
<!--
This file is protected by Copyright. Please refer to the COPYRIGHT file
distributed with this source distribution.

This file is part of REDHAWK core.

REDHAWK core is free software: you can redistribute it and/or modify it under
the terms of the GNU Lesser General Public License as published by the Free
Software Foundation, either version 3 of the License, or (at your option) any
later version.

REDHAWK core is distributed in the hope that it will be useful, but WITHOUT ANY
WARRANTY; without even the implied warranty of MERCHANTABILITY or FITNESS FOR
A PARTICULAR PURPOSE.  See the GNU Lesser General Public License for more
details.

You should have received a copy of the GNU Lesser General Public License along
with this program.  If not, see http://www.gnu.org/licenses/.
-->
<!DOCTYPE softwareassembly PUBLIC "-//JTRS//DTD SCA V2.2.2 SAD//EN" "softwareassembly.dtd">
<softwareassembly id="DCE:6774de87-310e-4b3e-b151-6e2ea0e8e9c2" name="cpp_comp_w">
  <componentfiles>
    <componentfile id="cpp_comp_e9451062-d2ea-4b33-9366-00fdcd1df5cd" type="SPD">
      <localfile name="/components/cpp_comp/cpp_comp.spd.xml"/>
    </componentfile>
  </componentfiles>
  <partitioning>
    <componentplacement>
      <componentfileref refid="cpp_comp_e9451062-d2ea-4b33-9366-00fdcd1df5cd"/>
      <componentinstantiation id="cpp_comp_1" startorder="0">
        <usagename>cpp_comp_1</usagename>
        <findcomponent>
          <namingservice name="cpp_comp_1"/>
        </findcomponent>
      </componentinstantiation>
    </componentplacement>
  </partitioning>
  <assemblycontroller>
    <componentinstantiationref refid="cpp_comp_1"/>
  </assemblycontroller>
  <options>
      <option name="AWARE_APPLICATION" value="false"/>
  </options>
</softwareassembly>
