<?xml version="1.0" encoding="UTF-8"?>
<!DOCTYPE softwareassembly PUBLIC "-//JTRS//DTD SCA V2.2.2 SAD//EN" "softwareassembly.dtd">
<softwareassembly id="DCE:243d883a-0123-4c94-94dc-5c129537f63d" name="newtime_w">
  <componentfiles>
    <componentfile id="newtime_b17cd7cc-aaa8-4cc6-b962-e9afd20840b3" type="SPD">
      <localfile name="/components/newtime/newtime.spd.xml"/>
    </componentfile>
  </componentfiles>
  <partitioning>
    <componentplacement>
      <componentfileref refid="newtime_b17cd7cc-aaa8-4cc6-b962-e9afd20840b3"/>
      <componentinstantiation id="newtime_1" startorder="0">
        <usagename>newtime_1</usagename>
        <componentproperties>
          <simpleref refid="rightnow" value="now"/>
        </componentproperties>
        <findcomponent>
          <namingservice name="newtime_1"/>
        </findcomponent>
      </componentinstantiation>
    </componentplacement>
  </partitioning>
  <assemblycontroller>
    <componentinstantiationref refid="newtime_1"/>
  </assemblycontroller>
</softwareassembly>
