<?xml version="1.0" encoding="UTF-8"?>
<!DOCTYPE softwareassembly PUBLIC "-//JTRS//DTD SCA V2.2.2 SAD//EN" "softwareassembly.dtd">
<softwareassembly id="DCE:1f44ec52-bcfb-4ea3-ac6f-dc316b308a00" name="logger_overload_w">
  <componentfiles>
    <componentfile id="logger_dd4afdb2-7405-4d7a-8fd1-cf54668b6c14" type="SPD">
      <localfile name="/components/logger/logger.spd.xml"/>
    </componentfile>
  </componentfiles>
  <partitioning>
    <componentplacement>
      <componentfileref refid="logger_dd4afdb2-7405-4d7a-8fd1-cf54668b6c14"/>
      <componentinstantiation id="logger_1" startorder="0">
        <usagename>logger_1</usagename>
        <findcomponent>
          <namingservice name="logger_1"/>
        </findcomponent>
      </componentinstantiation>
    </componentplacement>
    <componentplacement>
      <componentfileref refid="logger_dd4afdb2-7405-4d7a-8fd1-cf54668b6c14"/>
      <componentinstantiation id="logger_2" startorder="1">
        <usagename>logger_2</usagename>
        <componentproperties>
          <simpleref refid="LOGGING_CONFIG_URI" value='file:///@@@CWD@@@/high_thresh.cfg'/>
        </componentproperties>
        <findcomponent>
          <namingservice name="logger_2"/>
        </findcomponent>
      </componentinstantiation>
    </componentplacement>
  </partitioning>
  <assemblycontroller>
    <componentinstantiationref refid="logger_1"/>
  </assemblycontroller>
</softwareassembly>
