<?xml version="1.0" encoding="UTF-8"?>
<!--
This file is protected by Copyright. Please refer to the COPYRIGHT file 
distributed with this source distribution.

This file is part of REDHAWK core.

REDHAWK core is free software: you can redistribute it and/or modify it under 
the terms of the GNU Lesser General Public License as published by the Free 
Software Foundation, either version 3 of the License, or (at your option) any 
later version.

REDHAWK core is distributed in the hope that it will be useful, but WITHOUT ANY 
WARRANTY; without even the implied warranty of MERCHANTABILITY or FITNESS FOR 
A PARTICULAR PURPOSE.  See the GNU Lesser General Public License for more 
details.

You should have received a copy of the GNU Lesser General Public License along 
with this program.  If not, see http://www.gnu.org/licenses/.
-->

<!DOCTYPE softwareassembly PUBLIC '-//JTRS//DTD SCA V2.2.2 SAD//EN' 'softwareassembly.dtd'>
<softwareassembly id="DCE:78e6f0ae-2f20-4345-8ac8-6b2f5120588c" name="TestCppsoftpkgDep">
    <componentfiles>
        <componentfile id="TestCppsoftpkgDep_592b8bd6-b011-4468-9417-705af45e907b" type="SPD">
            <localfile name="/components/TestCppsoftpkgDeps/TestCppsoftpkgDeps.spd.xml"/>
        </componentfile>
    </componentfiles>
    <partitioning>
        <componentplacement>
            <componentfileref refid="TestCppsoftpkgDep_592b8bd6-b011-4468-9417-705af45e907b"/>
            <componentinstantiation id="DCE:d87a0d0d-8808-45fc-ad6a-44c276aa1e18">
                <usagename>CommandWrapperSPDDep1</usagename> 
                <findcomponent>
                    <namingservice name="TestCppsoftpkgDep1"/>
                </findcomponent>
            </componentinstantiation>
        </componentplacement>
    </partitioning>
    <assemblycontroller>
        <componentinstantiationref refid="DCE:d87a0d0d-8808-45fc-ad6a-44c276aa1e18"/>
    </assemblycontroller>
    <connections>
    </connections>
</softwareassembly>
