<?xml version="1.0" encoding="UTF-8"?>
<!--
This file is protected by Copyright. Please refer to the COPYRIGHT file
distributed with this source distribution.

This file is part of REDHAWK core.

REDHAWK core is free software: you can redistribute it and/or modify it under
the terms of the GNU Lesser General Public License as published by the Free
Software Foundation, either version 3 of the License, or (at your option) any
later version.

REDHAWK core is distributed in the hope that it will be useful, but WITHOUT ANY
WARRANTY; without even the implied warranty of MERCHANTABILITY or FITNESS FOR
A PARTICULAR PURPOSE.  See the GNU Lesser General Public License for more
details.

You should have received a copy of the GNU Lesser General Public License along
with this program.  If not, see http://www.gnu.org/licenses/.
-->
<!DOCTYPE softwareassembly PUBLIC "-//JTRS//DTD SCA V2.2.2 SAD//EN" "softwareassembly.dtd">
<softwareassembly id="DCE:8ced184a-0b38-4876-a7e7-0e63c9872487" name="NicAllocWaveJava">
  <componentfiles>
    <componentfile id="NicAllocJava_c786630d-8b61-45c3-a96f-fb45b2204a41" type="SPD">
      <localfile name="/components/NicAlloc/NicAllocJava.spd.xml"/>
    </componentfile>
  </componentfiles>
  <partitioning>
    <componentplacement>
      <componentfileref refid="NicAllocJava_c786630d-8b61-45c3-a96f-fb45b2204a41"/>
      <componentinstantiation id="NicAllocJava_1" startorder="0">
        <usagename>NicAllocJava_1</usagename>
        <findcomponent>
          <namingservice name="NicAllocJava_1"/>
        </findcomponent>
      </componentinstantiation>
    </componentplacement>
  </partitioning>
  <assemblycontroller>
    <componentinstantiationref refid="NicAllocJava_1"/>
  </assemblycontroller>
</softwareassembly>
