<?xml version="1.0" encoding="UTF-8"?>
<!DOCTYPE softwareassembly PUBLIC "-//JTRS//DTD SCA V2.2.2 SAD//EN" "softwareassembly.dtd">
<softwareassembly id="DCE:66829720-bd70-4b86-a061-7add0656513d" name="time_py_now_w">
  <componentfiles>
    <componentfile id="time_py_now_aa8ef331-00c6-45da-b4ad-402f3279af62" type="SPD">
      <localfile name="/components/time_py_now/time_py_now.spd.xml"/>
    </componentfile>
  </componentfiles>
  <partitioning>
    <componentplacement>
      <componentfileref refid="time_py_now_aa8ef331-00c6-45da-b4ad-402f3279af62"/>
      <componentinstantiation id="time_py_now_1" startorder="0">
        <usagename>time_py_now_1</usagename>
        <findcomponent>
          <namingservice name="time_py_now_1"/>
        </findcomponent>
      </componentinstantiation>
    </componentplacement>
  </partitioning>
  <assemblycontroller>
    <componentinstantiationref refid="time_py_now_1"/>
  </assemblycontroller>
</softwareassembly>
