<?xml version="1.0" encoding="UTF-8"?>
<!--
This file is protected by Copyright. Please refer to the COPYRIGHT file 
distributed with this source distribution.

This file is part of REDHAWK core.

REDHAWK core is free software: you can redistribute it and/or modify it under 
the terms of the GNU Lesser General Public License as published by the Free 
Software Foundation, either version 3 of the License, or (at your option) any 
later version.

REDHAWK core is distributed in the hope that it will be useful, but WITHOUT ANY 
WARRANTY; without even the implied warranty of MERCHANTABILITY or FITNESS FOR 
A PARTICULAR PURPOSE.  See the GNU Lesser General Public License for more 
details.

You should have received a copy of the GNU Lesser General Public License along 
with this program.  If not, see http://www.gnu.org/licenses/.
-->

<!DOCTYPE softwareassembly PUBLIC "-//JTRS//DTD SCA V2.2.2 SAD//EN" "softwareassembly.dtd">
<softwareassembly id="DCE:88c7f77d-54be-406b-a716-50babf48beca" name="test_collocation_single">
  <componentfiles>
    <componentfile id="NOOP_CAP_87d4ee48-2e3b-4a3e-9f6f-69746e2af2a4" type="SPD">
      <localfile name="/components/NOOP_CAP/NOOP_CAP.spd.xml"/>
    </componentfile>
  </componentfiles>
  <partitioning>
    <hostcollocation id="ID_COLLECT1" name="COLLOC_SET1">
      <componentplacement>
        <componentfileref refid="NOOP_CAP_87d4ee48-2e3b-4a3e-9f6f-69746e2af2a4"/>
        <componentinstantiation id="NOOP_CAP_1" startorder="0">
          <usagename>NOOP_CAP_1</usagename>
          <findcomponent>
            <namingservice name="NOOP_CAP_1"/>
          </findcomponent>
        </componentinstantiation>
      </componentplacement>
      <componentplacement>
        <componentfileref refid="NOOP_CAP_87d4ee48-2e3b-4a3e-9f6f-69746e2af2a4"/>
        <componentinstantiation id="NOOP_CAP_2" startorder="1">
          <usagename>NOOP_CAP_2</usagename>
          <findcomponent>
            <namingservice name="NOOP_CAP_2"/>
          </findcomponent>
        </componentinstantiation>
      </componentplacement>
    </hostcollocation>
  </partitioning>
  <assemblycontroller>
    <componentinstantiationref refid="NOOP_CAP_1"/>
  </assemblycontroller>
</softwareassembly>
