<?xml version="1.0" encoding="UTF-8"?>
<!--
This file is protected by Copyright. Please refer to the COPYRIGHT file 
distributed with this source distribution.

This file is part of REDHAWK core.

REDHAWK core is free software: you can redistribute it and/or modify it under 
the terms of the GNU Lesser General Public License as published by the Free 
Software Foundation, either version 3 of the License, or (at your option) any 
later version.

REDHAWK core is distributed in the hope that it will be useful, but WITHOUT ANY 
WARRANTY; without even the implied warranty of MERCHANTABILITY or FITNESS FOR 
A PARTICULAR PURPOSE.  See the GNU Lesser General Public License for more 
details.

You should have received a copy of the GNU Lesser General Public License along 
with this program.  If not, see http://www.gnu.org/licenses/.
-->

<!DOCTYPE softwareassembly PUBLIC '-//JTRS//DTD SCA V2.2.2 SAD//EN' 'softwareassembly.dtd'>
<softwareassembly id="DCE:7d4ff6a8-afea-485b-a804-9f818062fcb1" name="TestPythonProps">
  <componentfiles>
    <componentfile id="TestPythonProps_c0c68899-dde6-4bfb-a80e-52fc1fb78fd4" type="SPD">
      <localfile name="/components/TestPythonProps/TestPythonProps.spd.xml"/>
    </componentfile>
  </componentfiles>
  <partitioning>
    <componentplacement>
      <componentfileref refid="TestPythonProps_c0c68899-dde6-4bfb-a80e-52fc1fb78fd4"/>
      <componentinstantiation id="DCE:f9d0fa95-4cf7-4ed1-a412-a7b9d2ab0ab1">
        <usagename>TestPythonProps1</usagename>
        <findcomponent>
          <namingservice name="TestPythonProps1"/>
        </findcomponent>
      </componentinstantiation>
    </componentplacement>
  </partitioning>
  <assemblycontroller>
    <componentinstantiationref refid="DCE:f9d0fa95-4cf7-4ed1-a412-a7b9d2ab0ab1"/>
  </assemblycontroller>
  <connections/>
</softwareassembly>
