<?xml version="1.0" encoding="UTF-8"?>
<!--
This file is protected by Copyright. Please refer to the COPYRIGHT file 
distributed with this source distribution.

This file is part of REDHAWK core.

REDHAWK core is free software: you can redistribute it and/or modify it under 
the terms of the GNU Lesser General Public License as published by the Free 
Software Foundation, either version 3 of the License, or (at your option) any 
later version.

REDHAWK core is distributed in the hope that it will be useful, but WITHOUT ANY 
WARRANTY; without even the implied warranty of MERCHANTABILITY or FITNESS FOR 
A PARTICULAR PURPOSE.  See the GNU Lesser General Public License for more 
details.

You should have received a copy of the GNU Lesser General Public License along 
with this program.  If not, see http://www.gnu.org/licenses/.
-->

<!DOCTYPE softwareassembly PUBLIC '-//JTRS//DTD SCA V2.2.2 SAD//EN' 'softwareassembly.dtd'>
<softwareassembly id="DCE:33057843-192e-47f3-8464-6ac5fa9d0962" name="CommandWrapperSPDDep_collide">
    <componentfiles>
        <componentfile id="CommandWrapperSPDDep_592b8bd6-b011-4468-9417-705af45e907b" type="SPD">
            <localfile name="/components/CommandWrapperSPDDep_collide/CommandWrapperSPDDep.spd.xml"/>
        </componentfile>
    </componentfiles>
    <partitioning>
        <componentplacement>
            <componentfileref refid="CommandWrapperSPDDep_592b8bd6-b011-4468-9417-705af45e907b"/>
            <componentinstantiation id="DCE:9c8c2367-22ad-499a-84a8-0a4a83aeb2ac">
                <usagename>CommandWrapperSPDDep1</usagename> 
                <findcomponent>
                    <namingservice name="CommandWrapperSPDDep1"/>
                </findcomponent>
            </componentinstantiation>
        </componentplacement>
    </partitioning>
    <assemblycontroller>
        <componentinstantiationref refid="DCE:9c8c2367-22ad-499a-84a8-0a4a83aeb2ac"/>
    </assemblycontroller>
    <connections>
    </connections>
</softwareassembly>
