<?xml version="1.0" encoding="UTF-8"?>
<!--
This file is protected by Copyright. Please refer to the COPYRIGHT file
distributed with this source distribution.

This file is part of REDHAWK core.

REDHAWK core is free software: you can redistribute it and/or modify it under
the terms of the GNU Lesser General Public License as published by the Free
Software Foundation, either version 3 of the License, or (at your option) any
later version.

REDHAWK core is distributed in the hope that it will be useful, but WITHOUT ANY
WARRANTY; without even the implied warranty of MERCHANTABILITY or FITNESS FOR
A PARTICULAR PURPOSE.  See the GNU Lesser General Public License for more
details.

You should have received a copy of the GNU Lesser General Public License along
with this program.  If not, see http://www.gnu.org/licenses/.
-->
<!DOCTYPE softwareassembly PUBLIC "-//JTRS//DTD SCA V2.2.2 SAD//EN" "softwareassembly.dtd">
<softwareassembly id="DCE:70eefaa2-ab8f-4e2b-9fff-0a53b21d8fe1" name="ServiceConnection">
  <componentfiles>
    <componentfile id="ServiceComponent_b9cc5ac4-85bc-453b-9a48-455091343eb4" type="SPD">
      <localfile name="/components/ServiceComponent/ServiceComponent.spd.xml"/>
    </componentfile>
  </componentfiles>
  <partitioning>
    <componentplacement>
      <componentfileref refid="ServiceComponent_b9cc5ac4-85bc-453b-9a48-455091343eb4"/>
      <componentinstantiation id="ServiceComponent_1" startorder="0">
        <usagename>ServiceComponent_1</usagename>
        <findcomponent>
          <namingservice name="ServiceComponent_1"/>
        </findcomponent>
      </componentinstantiation>
    </componentplacement>
  </partitioning>
  <assemblycontroller>
    <componentinstantiationref refid="ServiceComponent_1"/>
  </assemblycontroller>
  <connections>
    <connectinterface id="connection_1">
      <usesport>
        <usesidentifier>output</usesidentifier>
        <componentinstantiationref refid="ServiceComponent_1"/>
      </usesport>
      <findby>
        <namingservice name="BasicService10"/>
      </findby>
    </connectinterface>
  </connections>
</softwareassembly>
