<?xml version="1.0" encoding="UTF-8"?>
<!--
This file is protected by Copyright. Please refer to the COPYRIGHT file
distributed with this source distribution.

This file is part of REDHAWK core.

REDHAWK core is free software: you can redistribute it and/or modify it under
the terms of the GNU Lesser General Public License as published by the Free
Software Foundation, either version 3 of the License, or (at your option) any
later version.

REDHAWK core is distributed in the hope that it will be useful, but WITHOUT ANY
WARRANTY; without even the implied warranty of MERCHANTABILITY or FITNESS FOR
A PARTICULAR PURPOSE.  See the GNU Lesser General Public License for more
details.

You should have received a copy of the GNU Lesser General Public License along
with this program.  If not, see http://www.gnu.org/licenses/.
-->
<!DOCTYPE softwareassembly PUBLIC "-//JTRS//DTD SCA V2.2.2 SAD//EN" "softwareassembly.dtd">
<softwareassembly id="DCE:791b9520-bb9b-4701-837d-6712d48fc5e9" name="NicAllocWavePy">
  <componentfiles>
    <componentfile id="NicAllocPy_0a4e2150-4499-45ee-ba5b-af4fa4d8b546" type="SPD">
      <localfile name="/components/NicAlloc/NicAllocPy.spd.xml"/>
    </componentfile>
  </componentfiles>
  <partitioning>
    <componentplacement>
      <componentfileref refid="NicAllocPy_0a4e2150-4499-45ee-ba5b-af4fa4d8b546"/>
      <componentinstantiation id="NicAllocPy_1" startorder="0">
        <usagename>NicAllocPy_1</usagename>
        <findcomponent>
          <namingservice name="NicAllocPy_1"/>
        </findcomponent>
      </componentinstantiation>
    </componentplacement>
  </partitioning>
  <assemblycontroller>
    <componentinstantiationref refid="NicAllocPy_1"/>
  </assemblycontroller>
</softwareassembly>
