<?xml version="1.0" encoding="UTF-8"?>
<!DOCTYPE softwareassembly PUBLIC "-//JTRS//DTD SCA V2.2.2 SAD//EN" "softwareassembly.dtd">
<softwareassembly id="DCE:c845059e-6b18-46d9-b31e-3406fc510336" name="ticket_cf_1066_wf">
  <componentfiles>
    <componentfile id="ticket_cf_1066_comp_31d0e725-b829-48cc-a9b8-415f5c0d486b" type="SPD">
      <localfile name="/components/ticket_cf_1066_comp/ticket_cf_1066_comp.spd.xml"/>
    </componentfile>
  </componentfiles>
  <partitioning>
    <componentplacement>
      <componentfileref refid="ticket_cf_1066_comp_31d0e725-b829-48cc-a9b8-415f5c0d486b"/>
      <componentinstantiation id="ticket_cf_1066_comp_1" startorder="0">
        <usagename>ticket_cf_1066_comp_1</usagename>
        <componentproperties>
          <simpleref refid="simple_prop" value="This is a string"/>
          <simplesequenceref refid="seq_prop">
            <values>
              <value>9</value>
              <value>8</value>
              <value>7</value>
            </values>
          </simplesequenceref>
          <structref refid="struct_prop">
            <simpleref refid="prop_two" value="string override"/>
          </structref>
          <structsequenceref refid="struct_seq_prop">
            <structvalue>
              <simpleref refid="prop_five" value="1"/>
              <simpleref refid="prop_six" value="123.0"/>
            </structvalue>
            <structvalue>
              <simpleref refid="prop_four" value="anotherString"/>
              <simpleref refid="prop_six" value="345.0"/>
            </structvalue>
            <structvalue>
              <simpleref refid="prop_four" value="string_override"/>
              <simpleref refid="prop_five" value="3"/>
              <simpleref refid="prop_six" value="678.0"/>
            </structvalue>
            <structvalue>
              <simpleref refid="prop_six" value="987.0"/>
            </structvalue>
          </structsequenceref>
        </componentproperties>
        <findcomponent>
          <namingservice name="ticket_cf_1066_comp_1"/>
        </findcomponent>
      </componentinstantiation>
    </componentplacement>
  </partitioning>
  <assemblycontroller>
    <componentinstantiationref refid="ticket_cf_1066_comp_1"/>
  </assemblycontroller>
</softwareassembly>
