<?xml version="1.0" encoding="UTF-8"?>
<!--
This file is protected by Copyright. Please refer to the COPYRIGHT file 
distributed with this source distribution.

This file is part of REDHAWK core.

REDHAWK core is free software: you can redistribute it and/or modify it under 
the terms of the GNU Lesser General Public License as published by the Free 
Software Foundation, either version 3 of the License, or (at your option) any 
later version.

REDHAWK core is distributed in the hope that it will be useful, but WITHOUT ANY 
WARRANTY; without even the implied warranty of MERCHANTABILITY or FITNESS FOR 
A PARTICULAR PURPOSE.  See the GNU Lesser General Public License for more 
details.

You should have received a copy of the GNU Lesser General Public License along 
with this program.  If not, see http://www.gnu.org/licenses/.
-->

<!DOCTYPE softwareassembly PUBLIC '-//JTRS//DTD SCA V2.2.2 SAD//EN' 'softwareassembly.dtd'>
<softwareassembly id="testcpp-props-wave" name="testcpp-props-wave" version="1.0">
    <componentfiles>
        <componentfile id="testcpp_file_1" type="SPD">
            <localfile name="/components/C2/C2.spd.xml"/>
        </componentfile>
    </componentfiles>
    <partitioning>
        <componentplacement>
            <componentfileref refid="testcpp_file_1"/>
            <componentinstantiation id="testcpp-props-wave:C2_1">
                <usagename>C2_1</usagename>
                <componentproperties>
                  <simpleref refid="LOGGING_CONFIG_URI" value="sca://logcfg/log.props.c2" />
                </componentproperties>
                <findcomponent>
                    <namingservice name="C2_1"/>
                </findcomponent>
            </componentinstantiation>
        </componentplacement>
    </partitioning>
    <assemblycontroller>
        <componentinstantiationref refid="testcpp-props-wave:C2_1"/>
    </assemblycontroller>
    <connections>
    </connections>
</softwareassembly>
